{
  "schema_name": "realtime",
  "function_count": 12,
  "functions": [
    {
      "schema_name": "realtime",
      "function_name": "apply_rls",
      "arguments": "wal jsonb, max_record_bytes integer DEFAULT (1024 * 1024)",
      "return_type": "SETOF realtime.wal_rls",
      "function_type": "Function",
      "function_definition": "CREATE OR REPLACE FUNCTION realtime.apply_rls(wal jsonb, max_record_bytes integer DEFAULT (1024 * 1024))\n RETURNS SETOF realtime.wal_rls\n LANGUAGE plpgsql\nAS $function$\ndeclare\n-- Regclass of the table e.g. public.notes\nentity_ regclass = (quote_ident(wal ->> 'schema') || '.' || quote_ident(wal ->> 'table'))::regclass;\n\n-- I, U, D, T: insert, update ...\naction realtime.action = (\n    case wal ->> 'action'\n        when 'I' then 'INSERT'\n        when 'U' then 'UPDATE'\n        when 'D' then 'DELETE'\n        else 'ERROR'\n    end\n);\n\n-- Is row level security enabled for the table\nis_rls_enabled bool = relrowsecurity from pg_class where oid = entity_;\n\nsubscriptions realtime.subscription[] = array_agg(subs)\n    from\n        realtime.subscription subs\n    where\n        subs.entity = entity_;\n\n-- Subscription vars\nroles regrole[] = array_agg(distinct us.claims_role::text)\n    from\n        unnest(subscriptions) us;\n\nworking_role regrole;\nclaimed_role regrole;\nclaims jsonb;\n\nsubscription_id uuid;\nsubscription_has_access bool;\nvisible_to_subscription_ids uuid[] = '{}';\n\n-- structured info for wal's columns\ncolumns realtime.wal_column[];\n-- previous identity values for update/delete\nold_columns realtime.wal_column[];\n\nerror_record_exceeds_max_size boolean = octet_length(wal::text) > max_record_bytes;\n\n-- Primary jsonb output for record\noutput jsonb;\n\nbegin\nperform set_config('role', null, true);\n\ncolumns =\n    array_agg(\n        (\n            x->>'name',\n            x->>'type',\n            x->>'typeoid',\n            realtime.cast(\n                (x->'value') #>> '{}',\n                coalesce(\n                    (x->>'typeoid')::regtype, -- null when wal2json version <= 2.4\n                    (x->>'type')::regtype\n                )\n            ),\n            (pks ->> 'name') is not null,\n            true\n        )::realtime.wal_column\n    )\n    from\n        jsonb_array_elements(wal -> 'columns') x\n        left join jsonb_array_elements(wal -> 'pk') pks\n            on (x ->> 'name') = (pks ->> 'name');\n\nold_columns =\n    array_agg(\n        (\n            x->>'name',\n            x->>'type',\n            x->>'typeoid',\n            realtime.cast(\n                (x->'value') #>> '{}',\n                coalesce(\n                    (x->>'typeoid')::regtype, -- null when wal2json version <= 2.4\n                    (x->>'type')::regtype\n                )\n            ),\n            (pks ->> 'name') is not null,\n            true\n        )::realtime.wal_column\n    )\n    from\n        jsonb_array_elements(wal -> 'identity') x\n        left join jsonb_array_elements(wal -> 'pk') pks\n            on (x ->> 'name') = (pks ->> 'name');\n\nfor working_role in select * from unnest(roles) loop\n\n    -- Update `is_selectable` for columns and old_columns\n    columns =\n        array_agg(\n            (\n                c.name,\n                c.type_name,\n                c.type_oid,\n                c.value,\n                c.is_pkey,\n                pg_catalog.has_column_privilege(working_role, entity_, c.name, 'SELECT')\n            )::realtime.wal_column\n        )\n        from\n            unnest(columns) c;\n\n    old_columns =\n            array_agg(\n                (\n                    c.name,\n                    c.type_name,\n                    c.type_oid,\n                    c.value,\n                    c.is_pkey,\n                    pg_catalog.has_column_privilege(working_role, entity_, c.name, 'SELECT')\n                )::realtime.wal_column\n            )\n            from\n                unnest(old_columns) c;\n\n    if action <> 'DELETE' and count(1) = 0 from unnest(columns) c where c.is_pkey then\n        return next (\n            jsonb_build_object(\n                'schema', wal ->> 'schema',\n                'table', wal ->> 'table',\n                'type', action\n            ),\n            is_rls_enabled,\n            -- subscriptions is already filtered by entity\n            (select array_agg(s.subscription_id) from unnest(subscriptions) as s where claims_role = working_role),\n            array['Error 400: Bad Request, no primary key']\n        )::realtime.wal_rls;\n\n    -- The claims role does not have SELECT permission to the primary key of entity\n    elsif action <> 'DELETE' and sum(c.is_selectable::int) <> count(1) from unnest(columns) c where c.is_pkey then\n        return next (\n            jsonb_build_object(\n                'schema', wal ->> 'schema',\n                'table', wal ->> 'table',\n                'type', action\n            ),\n            is_rls_enabled,\n            (select array_agg(s.subscription_id) from unnest(subscriptions) as s where claims_role = working_role),\n            array['Error 401: Unauthorized']\n        )::realtime.wal_rls;\n\n    else\n        output = jsonb_build_object(\n            'schema', wal ->> 'schema',\n            'table', wal ->> 'table',\n            'type', action,\n            'commit_timestamp', to_char(\n                ((wal ->> 'timestamp')::timestamptz at time zone 'utc'),\n                'YYYY-MM-DD\"T\"HH24:MI:SS.MS\"Z\"'\n            ),\n            'columns', (\n                select\n                    jsonb_agg(\n                        jsonb_build_object(\n                            'name', pa.attname,\n                            'type', pt.typname\n                        )\n                        order by pa.attnum asc\n                    )\n                from\n                    pg_attribute pa\n                    join pg_type pt\n                        on pa.atttypid = pt.oid\n                where\n                    attrelid = entity_\n                    and attnum > 0\n                    and pg_catalog.has_column_privilege(working_role, entity_, pa.attname, 'SELECT')\n            )\n        )\n        -- Add \"record\" key for insert and update\n        || case\n            when action in ('INSERT', 'UPDATE') then\n                jsonb_build_object(\n                    'record',\n                    (\n                        select\n                            jsonb_object_agg(\n                                -- if unchanged toast, get column name and value from old record\n                                coalesce((c).name, (oc).name),\n                                case\n                                    when (c).name is null then (oc).value\n                                    else (c).value\n                                end\n                            )\n                        from\n                            unnest(columns) c\n                            full outer join unnest(old_columns) oc\n                                on (c).name = (oc).name\n                        where\n                            coalesce((c).is_selectable, (oc).is_selectable)\n                            and ( not error_record_exceeds_max_size or (octet_length((c).value::text) <= 64))\n                    )\n                )\n            else '{}'::jsonb\n        end\n        -- Add \"old_record\" key for update and delete\n        || case\n            when action = 'UPDATE' then\n                jsonb_build_object(\n                        'old_record',\n                        (\n                            select jsonb_object_agg((c).name, (c).value)\n                            from unnest(old_columns) c\n                            where\n                                (c).is_selectable\n                                and ( not error_record_exceeds_max_size or (octet_length((c).value::text) <= 64))\n                        )\n                    )\n            when action = 'DELETE' then\n                jsonb_build_object(\n                    'old_record',\n                    (\n                        select jsonb_object_agg((c).name, (c).value)\n                        from unnest(old_columns) c\n                        where\n                            (c).is_selectable\n                            and ( not error_record_exceeds_max_size or (octet_length((c).value::text) <= 64))\n                            and ( not is_rls_enabled or (c).is_pkey ) -- if RLS enabled, we can't secure deletes so filter to pkey\n                    )\n                )\n            else '{}'::jsonb\n        end;\n\n        -- Create the prepared statement\n        if is_rls_enabled and action <> 'DELETE' then\n            if (select 1 from pg_prepared_statements where name = 'walrus_rls_stmt' limit 1) > 0 then\n                deallocate walrus_rls_stmt;\n            end if;\n            execute realtime.build_prepared_statement_sql('walrus_rls_stmt', entity_, columns);\n        end if;\n\n        visible_to_subscription_ids = '{}';\n\n        for subscription_id, claims in (\n                select\n                    subs.subscription_id,\n                    subs.claims\n                from\n                    unnest(subscriptions) subs\n                where\n                    subs.entity = entity_\n                    and subs.claims_role = working_role\n                    and (\n                        realtime.is_visible_through_filters(columns, subs.filters)\n                        or (\n                          action = 'DELETE'\n                          and realtime.is_visible_through_filters(old_columns, subs.filters)\n                        )\n                    )\n        ) loop\n\n            if not is_rls_enabled or action = 'DELETE' then\n                visible_to_subscription_ids = visible_to_subscription_ids || subscription_id;\n            else\n                -- Check if RLS allows the role to see the record\n                perform\n                    -- Trim leading and trailing quotes from working_role because set_config\n                    -- doesn't recognize the role as valid if they are included\n                    set_config('role', trim(both '\"' from working_role::text), true),\n                    set_config('request.jwt.claims', claims::text, true);\n\n                execute 'execute walrus_rls_stmt' into subscription_has_access;\n\n                if subscription_has_access then\n                    visible_to_subscription_ids = visible_to_subscription_ids || subscription_id;\n                end if;\n            end if;\n        end loop;\n\n        perform set_config('role', null, true);\n\n        return next (\n            output,\n            is_rls_enabled,\n            visible_to_subscription_ids,\n            case\n                when error_record_exceeds_max_size then array['Error 413: Payload Too Large']\n                else '{}'\n            end\n        )::realtime.wal_rls;\n\n    end if;\nend loop;\n\nperform set_config('role', null, true);\nend;\n$function$\n"
    },
    {
      "schema_name": "realtime",
      "function_name": "broadcast_changes",
      "arguments": "topic_name text, event_name text, operation text, table_name text, table_schema text, new record, old record, level text DEFAULT 'ROW'::text",
      "return_type": "void",
      "function_type": "Function",
      "function_definition": "CREATE OR REPLACE FUNCTION realtime.broadcast_changes(topic_name text, event_name text, operation text, table_name text, table_schema text, new record, old record, level text DEFAULT 'ROW'::text)\n RETURNS void\n LANGUAGE plpgsql\nAS $function$\nDECLARE\n    -- Declare a variable to hold the JSONB representation of the row\n    row_data jsonb := '{}'::jsonb;\nBEGIN\n    IF level = 'STATEMENT' THEN\n        RAISE EXCEPTION 'function can only be triggered for each row, not for each statement';\n    END IF;\n    -- Check the operation type and handle accordingly\n    IF operation = 'INSERT' OR operation = 'UPDATE' OR operation = 'DELETE' THEN\n        row_data := jsonb_build_object('old_record', OLD, 'record', NEW, 'operation', operation, 'table', table_name, 'schema', table_schema);\n        PERFORM realtime.send (row_data, event_name, topic_name);\n    ELSE\n        RAISE EXCEPTION 'Unexpected operation type: %', operation;\n    END IF;\nEXCEPTION\n    WHEN OTHERS THEN\n        RAISE EXCEPTION 'Failed to process the row: %', SQLERRM;\nEND;\n\n$function$\n"
    },
    {
      "schema_name": "realtime",
      "function_name": "build_prepared_statement_sql",
      "arguments": "prepared_statement_name text, entity regclass, columns realtime.wal_column[]",
      "return_type": "text",
      "function_type": "Function",
      "function_definition": "CREATE OR REPLACE FUNCTION realtime.build_prepared_statement_sql(prepared_statement_name text, entity regclass, columns realtime.wal_column[])\n RETURNS text\n LANGUAGE sql\nAS $function$\n      /*\n      Builds a sql string that, if executed, creates a prepared statement to\n      tests retrive a row from *entity* by its primary key columns.\n      Example\n          select realtime.build_prepared_statement_sql('public.notes', '{\"id\"}'::text[], '{\"bigint\"}'::text[])\n      */\n          select\n      'prepare ' || prepared_statement_name || ' as\n          select\n              exists(\n                  select\n                      1\n                  from\n                      ' || entity || '\n                  where\n                      ' || string_agg(quote_ident(pkc.name) || '=' || quote_nullable(pkc.value #>> '{}') , ' and ') || '\n              )'\n          from\n              unnest(columns) pkc\n          where\n              pkc.is_pkey\n          group by\n              entity\n      $function$\n"
    },
    {
      "schema_name": "realtime",
      "function_name": "cast",
      "arguments": "val text, type_ regtype",
      "return_type": "jsonb",
      "function_type": "Function",
      "function_definition": "CREATE OR REPLACE FUNCTION realtime.\"cast\"(val text, type_ regtype)\n RETURNS jsonb\n LANGUAGE plpgsql\n IMMUTABLE\nAS $function$\n    declare\n      res jsonb;\n    begin\n      execute format('select to_jsonb(%L::'|| type_::text || ')', val)  into res;\n      return res;\n    end\n    $function$\n"
    },
    {
      "schema_name": "realtime",
      "function_name": "check_equality_op",
      "arguments": "op realtime.equality_op, type_ regtype, val_1 text, val_2 text",
      "return_type": "boolean",
      "function_type": "Function",
      "function_definition": "CREATE OR REPLACE FUNCTION realtime.check_equality_op(op realtime.equality_op, type_ regtype, val_1 text, val_2 text)\n RETURNS boolean\n LANGUAGE plpgsql\n IMMUTABLE\nAS $function$\n      /*\n      Casts *val_1* and *val_2* as type *type_* and check the *op* condition for truthiness\n      */\n      declare\n          op_symbol text = (\n              case\n                  when op = 'eq' then '='\n                  when op = 'neq' then '!='\n                  when op = 'lt' then '<'\n                  when op = 'lte' then '<='\n                  when op = 'gt' then '>'\n                  when op = 'gte' then '>='\n                  when op = 'in' then '= any'\n                  else 'UNKNOWN OP'\n              end\n          );\n          res boolean;\n      begin\n          execute format(\n              'select %L::'|| type_::text || ' ' || op_symbol\n              || ' ( %L::'\n              || (\n                  case\n                      when op = 'in' then type_::text || '[]'\n                      else type_::text end\n              )\n              || ')', val_1, val_2) into res;\n          return res;\n      end;\n      $function$\n"
    },
    {
      "schema_name": "realtime",
      "function_name": "is_visible_through_filters",
      "arguments": "columns realtime.wal_column[], filters realtime.user_defined_filter[]",
      "return_type": "boolean",
      "function_type": "Function",
      "function_definition": "CREATE OR REPLACE FUNCTION realtime.is_visible_through_filters(columns realtime.wal_column[], filters realtime.user_defined_filter[])\n RETURNS boolean\n LANGUAGE sql\n IMMUTABLE\nAS $function$\n    /*\n    Should the record be visible (true) or filtered out (false) after *filters* are applied\n    */\n        select\n            -- Default to allowed when no filters present\n            $2 is null -- no filters. this should not happen because subscriptions has a default\n            or array_length($2, 1) is null -- array length of an empty array is null\n            or bool_and(\n                coalesce(\n                    realtime.check_equality_op(\n                        op:=f.op,\n                        type_:=coalesce(\n                            col.type_oid::regtype, -- null when wal2json version <= 2.4\n                            col.type_name::regtype\n                        ),\n                        -- cast jsonb to text\n                        val_1:=col.value #>> '{}',\n                        val_2:=f.value\n                    ),\n                    false -- if null, filter does not match\n                )\n            )\n        from\n            unnest(filters) f\n            join unnest(columns) col\n                on f.column_name = col.name;\n    $function$\n"
    },
    {
      "schema_name": "realtime",
      "function_name": "list_changes",
      "arguments": "publication name, slot_name name, max_changes integer, max_record_bytes integer",
      "return_type": "SETOF realtime.wal_rls",
      "function_type": "Function",
      "function_definition": "CREATE OR REPLACE FUNCTION realtime.list_changes(publication name, slot_name name, max_changes integer, max_record_bytes integer)\n RETURNS SETOF realtime.wal_rls\n LANGUAGE sql\n SET log_min_messages TO 'fatal'\nAS $function$\n      with pub as (\n        select\n          concat_ws(\n            ',',\n            case when bool_or(pubinsert) then 'insert' else null end,\n            case when bool_or(pubupdate) then 'update' else null end,\n            case when bool_or(pubdelete) then 'delete' else null end\n          ) as w2j_actions,\n          coalesce(\n            string_agg(\n              realtime.quote_wal2json(format('%I.%I', schemaname, tablename)::regclass),\n              ','\n            ) filter (where ppt.tablename is not null and ppt.tablename not like '% %'),\n            ''\n          ) w2j_add_tables\n        from\n          pg_publication pp\n          left join pg_publication_tables ppt\n            on pp.pubname = ppt.pubname\n        where\n          pp.pubname = publication\n        group by\n          pp.pubname\n        limit 1\n      ),\n      w2j as (\n        select\n          x.*, pub.w2j_add_tables\n        from\n          pub,\n          pg_logical_slot_get_changes(\n            slot_name, null, max_changes,\n            'include-pk', 'true',\n            'include-transaction', 'false',\n            'include-timestamp', 'true',\n            'include-type-oids', 'true',\n            'format-version', '2',\n            'actions', pub.w2j_actions,\n            'add-tables', pub.w2j_add_tables\n          ) x\n      )\n      select\n        xyz.wal,\n        xyz.is_rls_enabled,\n        xyz.subscription_ids,\n        xyz.errors\n      from\n        w2j,\n        realtime.apply_rls(\n          wal := w2j.data::jsonb,\n          max_record_bytes := max_record_bytes\n        ) xyz(wal, is_rls_enabled, subscription_ids, errors)\n      where\n        w2j.w2j_add_tables <> ''\n        and xyz.subscription_ids[1] is not null\n    $function$\n"
    },
    {
      "schema_name": "realtime",
      "function_name": "quote_wal2json",
      "arguments": "entity regclass",
      "return_type": "text",
      "function_type": "Function",
      "function_definition": "CREATE OR REPLACE FUNCTION realtime.quote_wal2json(entity regclass)\n RETURNS text\n LANGUAGE sql\n IMMUTABLE STRICT\nAS $function$\n      select\n        (\n          select string_agg('' || ch,'')\n          from unnest(string_to_array(nsp.nspname::text, null)) with ordinality x(ch, idx)\n          where\n            not (x.idx = 1 and x.ch = '\"')\n            and not (\n              x.idx = array_length(string_to_array(nsp.nspname::text, null), 1)\n              and x.ch = '\"'\n            )\n        )\n        || '.'\n        || (\n          select string_agg('' || ch,'')\n          from unnest(string_to_array(pc.relname::text, null)) with ordinality x(ch, idx)\n          where\n            not (x.idx = 1 and x.ch = '\"')\n            and not (\n              x.idx = array_length(string_to_array(nsp.nspname::text, null), 1)\n              and x.ch = '\"'\n            )\n          )\n      from\n        pg_class pc\n        join pg_namespace nsp\n          on pc.relnamespace = nsp.oid\n      where\n        pc.oid = entity\n    $function$\n"
    },
    {
      "schema_name": "realtime",
      "function_name": "send",
      "arguments": "payload jsonb, event text, topic text, private boolean DEFAULT true",
      "return_type": "void",
      "function_type": "Function",
      "function_definition": "CREATE OR REPLACE FUNCTION realtime.send(payload jsonb, event text, topic text, private boolean DEFAULT true)\n RETURNS void\n LANGUAGE plpgsql\nAS $function$\nBEGIN\n  BEGIN\n    -- Set the topic configuration\n    EXECUTE format('SET LOCAL realtime.topic TO %L', topic);\n\n    -- Attempt to insert the message\n    INSERT INTO realtime.messages (payload, event, topic, private, extension)\n    VALUES (payload, event, topic, private, 'broadcast');\n  EXCEPTION\n    WHEN OTHERS THEN\n      -- Capture and notify the error\n      RAISE WARNING 'ErrorSendingBroadcastMessage: %', SQLERRM;\n  END;\nEND;\n$function$\n"
    },
    {
      "schema_name": "realtime",
      "function_name": "subscription_check_filters",
      "arguments": "",
      "return_type": "trigger",
      "function_type": "Function",
      "function_definition": "CREATE OR REPLACE FUNCTION realtime.subscription_check_filters()\n RETURNS trigger\n LANGUAGE plpgsql\nAS $function$\n    /*\n    Validates that the user defined filters for a subscription:\n    - refer to valid columns that the claimed role may access\n    - values are coercable to the correct column type\n    */\n    declare\n        col_names text[] = coalesce(\n                array_agg(c.column_name order by c.ordinal_position),\n                '{}'::text[]\n            )\n            from\n                information_schema.columns c\n            where\n                format('%I.%I', c.table_schema, c.table_name)::regclass = new.entity\n                and pg_catalog.has_column_privilege(\n                    (new.claims ->> 'role'),\n                    format('%I.%I', c.table_schema, c.table_name)::regclass,\n                    c.column_name,\n                    'SELECT'\n                );\n        filter realtime.user_defined_filter;\n        col_type regtype;\n\n        in_val jsonb;\n    begin\n        for filter in select * from unnest(new.filters) loop\n            -- Filtered column is valid\n            if not filter.column_name = any(col_names) then\n                raise exception 'invalid column for filter %', filter.column_name;\n            end if;\n\n            -- Type is sanitized and safe for string interpolation\n            col_type = (\n                select atttypid::regtype\n                from pg_catalog.pg_attribute\n                where attrelid = new.entity\n                      and attname = filter.column_name\n            );\n            if col_type is null then\n                raise exception 'failed to lookup type for column %', filter.column_name;\n            end if;\n\n            -- Set maximum number of entries for in filter\n            if filter.op = 'in'::realtime.equality_op then\n                in_val = realtime.cast(filter.value, (col_type::text || '[]')::regtype);\n                if coalesce(jsonb_array_length(in_val), 0) > 100 then\n                    raise exception 'too many values for `in` filter. Maximum 100';\n                end if;\n            else\n                -- raises an exception if value is not coercable to type\n                perform realtime.cast(filter.value, col_type);\n            end if;\n\n        end loop;\n\n        -- Apply consistent order to filters so the unique constraint on\n        -- (subscription_id, entity, filters) can't be tricked by a different filter order\n        new.filters = coalesce(\n            array_agg(f order by f.column_name, f.op, f.value),\n            '{}'\n        ) from unnest(new.filters) f;\n\n        return new;\n    end;\n    $function$\n"
    },
    {
      "schema_name": "realtime",
      "function_name": "to_regrole",
      "arguments": "role_name text",
      "return_type": "regrole",
      "function_type": "Function",
      "function_definition": "CREATE OR REPLACE FUNCTION realtime.to_regrole(role_name text)\n RETURNS regrole\n LANGUAGE sql\n IMMUTABLE\nAS $function$ select role_name::regrole $function$\n"
    },
    {
      "schema_name": "realtime",
      "function_name": "topic",
      "arguments": "",
      "return_type": "text",
      "function_type": "Function",
      "function_definition": "CREATE OR REPLACE FUNCTION realtime.topic()\n RETURNS text\n LANGUAGE sql\n STABLE\nAS $function$\nselect nullif(current_setting('realtime.topic', true), '')::text;\n$function$\n"
    }
  ]
}